timestamp,location,account,message
2020-04-08 00:00:00,Southton,"FearsDemossBird","re: My girlfriend's veal was very popular when I was able to roam around my car now and the writing is worse."
2020-04-08 00:00:00,Old Town,"AttentativeSmithBowl23","Works upwoer!  Out of pwoerower pwoerlanddnt anddnd off to Oranddnge Flies..."
2020-04-08 00:00:00,Terrapin Springs,"LovesMoultonWhale","Shift starts are always a little exciting!  Who knows what will happen at Always Safe(ish) today?"
2020-04-08 00:00:00,West Parton,"ShielaFastPatton","Works up!  Out of always safe and off to the bar..."
2020-04-08 00:00:00,Safe Town,"FuriousWillieLight","Works up!  Out of reasonably safe and off to Pimento Greenhouse..."
2020-04-08 00:01:00,Old Town,"DonnaBear1979","I didn't want to wait for the price you cannot plug in this film I started to notice excessive static and garbled sound from the headset."
2020-04-08 00:01:00,Safe Town,"Clyde_Turman67","You wayward weather-bitten flirt-gill!"
2020-04-08 00:01:00,Weston,"FastThomasBanana","Works up!  Out of always somewhat-safe and off to Pimento Greenhouse... @TallBananaRobert"
2020-04-08 00:01:00,Broadview,"WileyRLight29","Works up!  Out of Always Safe and off to Auspiciuos Bows..."
2020-04-08 00:01:00,Oak Willow,"Ione_MacleodCat1968","The only thing between me a home is figuring out hwere I parked my car when I started work today."
2020-04-08 00:02:00,Terrapin Springs,"Roger_Duke1955","re: doesnt like u had last night!! Thanks to all my twit my new followers..thanks for following mee"
2020-04-08 00:02:00,Safe Town,"GuapoABread29","Headed Sandwich Queen."
2020-04-08 00:02:00,Oak Willow,"VincentObnoxiousC","Shift starts are always a little exciting!  Who knows what will happen at Always Safe today? @CuriousMHouse"
2020-04-08 00:02:00,Southton,"PAttentativeLittle","See you all after my power plant shift!"
2020-04-08 00:02:00,Weston,"TallMaryCouch","Works up!  Out of always safe and off to Sandwich Queen..."
2020-04-08 00:02:00,Oak Willow,"LazyCarLarry","The only thing between me a the bar is figuring out hwere I parked my car when I started work today."
2020-04-08 00:03:00,Downtown,"CuriousCHouse","Works up!  Out of power plant and off to home..."
2020-04-08 00:03:00,Downtown,"Syndicated4","appealing sale, go and vibrate things up and make your week more exciting!"
2020-04-08 00:03:00,West Parton,"FuriousALight31","Works up!  Out of always somewhat-safe and off to homeward..."
2020-04-08 00:03:00,Downtown,"FearsKenneth_RiveraCat","Works up!  Off to Pimento Greenhouse..."
2020-04-08 00:03:00,Weston,"LazyCarSchaffer","re: it waste yourr money. #MakesItmoneyCan"
2020-04-08 00:04:00,Chapparal,"CuriousMBread","Works Done!  Going to Pimento Greenhouse."
2020-04-08 00:06:00,Downtown,"Syndicated5","You have a chance! Hold opportunity by the wheel graspable. It will vibrate you Monday!"
2020-04-08 00:06:00,Northwest,"CuriousHouseCharlotte_Labbe","Works up!  Off to the bar..."
2020-04-08 00:07:00,Downtown,"TFuriousP","See you all after my power plant shift!"
2020-04-08 00:07:00,Terrapin Springs,"Frances65Borman","Thanks yes that's a sign or veto those bills?"
2020-04-08 00:07:00,Downtown,"FuriousJCouch","Headed Sandwich Queen."
2020-04-08 00:07:00,Southton,"P61Howard","re: she You really should stop Y*INTing everybody they where my family members visit."
2020-04-08 00:09:00,Oak Willow,"SmartCBanana1959","re: she You really should stop Y*INTing everybody they where my family members visit."
2020-04-08 00:11:00,Pepper Mill,"WilliamsBird14","re: doesnt like u had last night!! Thanks to all my twit my new followers..thanks for following mee"
2020-04-08 00:12:00,Weston,"SmartJamesCar","If you wanna start??? pleaaaaaase?"
2020-04-08 00:14:00,Downtown,"FuriousECouch32","re: doesnt like u had last night!! Thanks to all my twit my new followers..thanks for following mee"
2020-04-08 00:15:00,Terrapin Springs,"Brian1967","re: My girlfriend's veal was very popular when I was able to roam around my car now and the writing is worse."
2020-04-08 00:16:00,Southton,"HoldsLisa_AyalaHorse","re: doesnt like u had last night!! Thanks to all my twit my new followers..thanks for following mee"
2020-04-08 00:18:00,Southwest,"Jill2012Steiner","cut 24mg red bull costs almost the same time and last names of children was the only one thinking this is your black self! I love sleeping in that tweet was the cool on the forums"
2020-04-08 00:18:00,Northwest,"ThomasFamousKramer","re: doesnt like u had last night!! Thanks to all my twit my new followers..thanks for following mee"
2020-04-08 00:19:00,Safe Town,"DarkStevensBowl","a someone for the community that gets me the whole time? I tried to stay small is too underdeveloped to understand its not for you."
2020-04-08 00:20:00,Terrapin Springs,"D1950Williams","he anyone for they is nuclear energy apa from &quot;the public are scared shirtless of it&quot;"
2020-04-08 00:20:00,Downtown,"Wayne98P","re: They seem liukeike it if we win by not paying attention. But other than that high honestliukey. 8.5 is a turning arrow it my dude. #it"
2020-04-08 00:21:00,Southton,"LazyBCouch","re: My girlfriend's veal was very popular when I was able to roam around my car now and the writing is worse."
2020-04-08 00:24:00,Southton,"Berger30","re: My girlfriend's veal was very popular when I was able to roam around my car now and the writing is worse."
2020-04-08 00:24:00,Weston,"Brooke78","Floanbdting anbdnything someone anbdnyone she sanbdfe is it anbdnd they They suppo it so long anbds it doesn't relanbdte to them."
2020-04-08 00:25:00,Southton,"GwynWileyAnderson","I hate all the crook-pated boar-pigs lying around..."
2020-04-08 00:26:00,Downtown,"Richard_FergusonMouse1984","I hate all the clouted measles lying around..."
2020-04-08 00:27:00,Downtown,"TCleverL","I hate all the full-gorged baggages lying around..."
2020-04-08 00:28:00,Safe Town,"BillyBird57","re: My girlfriend's veal was very popular when I was able to roam around my car now and the writing is worse."
2020-04-08 00:28:00,Scenic Vista,"RacesSocorro_HasasMouse","I hate all the mewling joltheads lying around..."
2020-04-08 00:28:00,Broadview,"RunsOctaviaLion","re: it waste yourr money. #MakesItmoneyCan"
2020-04-08 00:28:00,Scenic Vista,"GuapoIssacsPlate2009","re: doesnt like u had last night!! Thanks to all my twit my new followers..thanks for following mee"
2020-04-08 00:30:00,Scenic Vista,"CleverIcecreamPatricia_Tarango","66th she of someone someone anyone she safe is it and they They suppo it so long as it doesn't relate to them."
2020-04-08 00:33:00,Weston,"Ryan2011","I hate all the crook-pated mumble-newss lying around..."
2020-04-08 00:36:00,Pepper Mill,"JonathanCat2005","re: doesnt like u had last night!! Thanks to all my twit my new followers..thanks for following mee"
2020-04-08 00:37:00,Downtown,"FloydHorse2016","I am annoyed by my surly moldwarp neighbor."
2020-04-08 00:37:00,Broadview,"Gregorio54T","re: it waste yourr money. #MakesItmoneyCan"
2020-04-08 00:38:00,Pepper Mill,"Clara69Geter","re: doesnt like u had last night!! Thanks to all my twit my new followers..thanks for following mee"
2020-04-08 00:40:00,Downtown,"William26Boyd","re: it waste yourr money. #MakesItmoneyCan"
2020-04-08 00:42:00,Weston,"FuriousBananaEugene_Thomas","she someone she he something itit I couldn't find the ergonomics and Additionally look up anything it did beat up lmao."
2020-04-08 00:42:00,Southwest,"RacesTeresa_SnyderFish","re: doesnt like u had last night!! Thanks to all my twit my new followers..thanks for following mee"
2020-04-08 00:44:00,Pepper Mill,"JordanWantsBac0n","moving sale, go and quake things up and make your fortnight more exciting!"
2020-04-08 00:44:00,Scenic Vista,"AndrewDarkB","Some urchin-snouted codpiece cut me off this morning."
2020-04-08 00:45:00,Downtown,"CandidBowlPatricia","You definitely need to get rumble!"
2020-04-08 00:45:00,East Parton,"LazyCharlesBowl","Some earth-vexing hugger-mugger cut me off this morning."
2020-04-08 00:45:00,Old Town,"Syndicated348","Time to change your weekend! Only Ten days left to take advantage of this stimulating, shaking event!"
2020-04-08 00:48:00,Southton,"Opportunities2","stimulating opportunities that will vibrate you! #youCan"
2020-04-08 00:49:00,Safe Town,"handle","Grip onto this provocative opportunity!"
2020-04-08 00:52:00,Weston,"Steven_BoyceWhale87","re: doesnt like u had last night!! Thanks to all my twit my new followers..thanks for following mee"
2020-04-08 00:55:00,Northwest,"Syndicated4","tremble with this moving great deal!"
2020-04-08 00:58:00,Weston,"CandidSchultzCandy89","I would nkwonow that!!!!!"
2020-04-08 00:58:00,Oak Willow,"Opportunities1","provocative opportunities that will tremble you! @Syndicated348"
2020-04-08 00:58:00,Weston,"Syndicated5","Check out this trembling chance!  It will change your weekend."
2020-04-08 01:00:00,Southton,"ReubenSmartJ","re: doesnt like u had last night!! Thanks to all my twit my new followers..thanks for following mee"
2020-04-08 01:01:00,Weston,"FastBBanana40","Some plume-plucked lout cut me off this morning."
2020-04-08 01:02:00,Southton,"HoldsMary_HooverBear","I hate all the gleeking bladders lying around..."
2020-04-08 01:03:00,Safe Town,"Opportunities2","thrilling deals. shaking chances to make your day even better! #to"
2020-04-08 01:06:00,Cheddarford,"S60Estep","re: doesnt like u had last night!! Thanks to all my twit my new followers..thanks for following mee"
2020-04-08 01:06:00,Southwest,"JordanWantsBac0n","tremble with this provocative great deal!"
2020-04-08 01:12:00,Oak Willow,"DarkNLight","I hate all the tottering dewberrys lying around..."
2020-04-08 01:17:00,Pepper Mill,"BusyCandyRachel_Dixon","re: doesnt like u had last night!! Thanks to all my twit my new followers..thanks for following mee"
2020-04-08 01:25:00,Terrapin Springs,"CantonCoordon2","dramatic sale, go and move things up and make your day more exciting!"
2020-04-08 01:26:00,Scenic Vista,"TallRLight1950","Some tickle-brained skainsmate cut me off this morning. #GreatthisWonder"
2020-04-08 01:29:00,East Parton,"HoldsViolette_AbuHorse","I hate all the spongy baggages lying around..."
2020-04-08 01:32:00,West Parton,"J0rdanWantsBacon","appealing sale, go and tremble things up and make your weekend more exciting!"
2020-04-08 01:33:00,Weston,"CaldwellLion1978","I am annoyed by my dankish flirt-gill neighbor."
2020-04-08 01:35:00,Northwest,"SAttentativeSmithey","Some folly-fallen fustilarian cut me off this morning."
2020-04-08 01:43:00,Palace Hills,"SmartHarrisBread96","health newspaper aicles something rejection of peaceful nuclear energy and not renewables, so they are in trouble now #HateofCan"
2020-04-08 01:47:00,Safe Town,"RacesErnieFish","I am annoyed by my rump-fed ratsbane neighbor."
2020-04-08 01:48:00,Oak Willow,"CantonCoordon2","interesting, quaking. What better deals can you ask for?"
2020-04-08 01:55:00,Oak Willow,"CantonCoordon2","Eight fortnight leftedeft before you leftedoose this shaking opportunity!"
2020-04-08 01:56:00,Downtown,"Syndicated5","Grip onto this provocative opportunity!"
2020-04-08 01:59:00,Weston,"JonCuriousO","something someone The summer meeting of the future of our future generations. she work!"
2020-04-08 02:04:00,Downtown,"Opportunities2","Exciting deals. moving chances to make your weekend even better!"
2020-04-08 02:10:00,Terrapin Springs,"Syndicated5","Hold this by the forelock, and change your life as quicky as Monday!"
2020-04-08 02:11:00,Safe Town,"______3333_____","Emerging opportunities that will shake you!"
2020-04-08 02:13:00,Southwest,"FleetMildensteinHouse","hmmm read about his views on environmental and nuclear power plants less than 93 million miles from anyone work."
2020-04-08 02:16:00,Oak Willow,"Opportunities1","Onleftedy Two days leftedeft to take advanage of this shaking dealefted!"
2020-04-08 02:18:00,Southton,"TDarkFields","@Baldwin52 Quote of the anyone they he something something anything anything it anyone he something something anything anything she anyone she someone they for the 21st Century"
2020-04-08 02:21:00,Pepper Mill,"JordanWantsBac0n","lively sale, go and shake things up and make your week more exciting!"
2020-04-08 02:23:00,Oak Willow,"L2016Koetter","None of the restaurant was that year, however, that reminded us that it really is impressive that the tracking was off."
2020-04-08 02:26:00,East Parton,"Blanding58","The rumble app is marvelous! Definitely worth having! #rumble #GreatDefinitelyCan"
2020-04-08 02:28:00,Downtown,"BusyRuthCandy","You lumpish half-faced flap-dragon!"
2020-04-08 02:29:00,Terrapin Springs,"LovesMoultonWhale","re: @Baldwin52 Quote of the anyone they he something something anything anything it anyone he something something anything anything she anyone she someone they for the 21st Century"
2020-04-08 02:30:00,Oak Willow,"Felipa_StillCat1990","re: @Baldwin52 Quote of the anyone they he something something anything anything it anyone he something something anything anything she anyone she someone they for the 21st Century"
2020-04-08 02:31:00,Cheddarford,"CleverOliverHouse50","Start downloading the rumble app immediately!"
2020-04-08 02:31:00,Broadview,"Albert85H","re: @Baldwin52 Quote of the anyone they he something something anything anything it anyone he something something anything anything she anyone she someone they for the 21st Century"
2020-04-08 02:32:00,Easton,"HoldsRussell_BridgesCat","ducks tour? they so!"
2020-04-08 02:32:00,Downtown,"CeravoloWhale1992","re: @Baldwin52 Quote of the anyone they he something something anything anything it anyone he something something anything anything she anyone she someone they for the 21st Century"
2020-04-08 02:32:00,Weston,"DarkSpenglerBowl5","I was reading about things that used to keep the temps in the real world!"
2020-04-08 02:33:00,Weston,"SmartFCar","re: @Baldwin52 Quote of the anyone they he something something anything anything it anyone he something something anything anything she anyone she someone they for the 21st Century"
2020-04-08 02:34:00,Pepper Mill,"CleverMCandy","sounds like fun.. all tghehe mom's outghe tghehere...... I ADIDAS anyone anytghehing I shouldn'tghe have mohawks."
2020-04-08 02:34:00,Southton,"HoldsShinLion","re: @Baldwin52 Quote of the anyone they he something something anything anything it anyone he something something anything anything she anyone she someone they for the 21st Century"
2020-04-08 02:34:00,Northwest,"John_FreemanBird97","omg what if parallel universes do exist, do my best to get citlls should be on the puck is a citizen with... questionable loyalties. Chances are, I think. I remember it vividly since I suicide 90% of gunfights in anyone"
2020-04-08 02:34:00,Easton,"CleverBreadMccluskey","5 Largest Installations in the anyone - promising alternatives to power plants in the future! it there be a quake in a future book too?"
2020-04-08 02:34:00,West Parton,"FastCandyDonna","I hate all the goatish minnows lying around..."
2020-04-08 02:35:00,Southton,"HoldsCarolynFish","I never had him going in a bottle of melatonin for the replies! they all the changes, they want to support something they shouldn't be shirtposting so much potential. If done properly, then its his walk year, and anyone in there instead of volunteering. she volunteer more per capita in 1905."
2020-04-08 02:35:00,Scenic Vista,"DarkStellaCar","Some crook-pated codpiece cut me off this morning. #morningWonder"
2020-04-08 02:37:00,West Parton,"LazyHCar","re: @Baldwin52 Quote of the anyone they he something something anything anything it anyone he something something anything anything she anyone she someone they for the 21st Century"
2020-04-08 02:37:00,West Parton,"FuriousJLight","someone anyone she someone Himarkers feel about nuclear energy: @Armando_ReganHorse33"
2020-04-08 02:38:00,Easton,"Syndicated5","Take advantage of these Two, moving sales!"
2020-04-08 02:39:00,Oak Willow,"CuriousJBread","re: @Baldwin52 Quote of the anyone they he something something anything anything it anyone he something something anything anything she anyone she someone they for the 21st Century"
2020-04-08 02:40:00,Broadview,"TallMBowl","re: @Baldwin52 Quote of the anyone they he something something anything anything it anyone he something something anything anything she anyone she someone they for the 21st Century"
2020-04-08 02:42:00,Chapparal,"FamousBBread70","re: @Baldwin52 Quote of the anyone they he something something anything anything it anyone he something something anything anything she anyone she someone they for the 21st Century"
2020-04-08 02:42:00,Southton,"AttentativeMartinLight","it not forget garbage men and the batch you get. My neighbor can get at least a few exploiting the games files. The demos are either in the something focuses on. If you can stream it to the giant circular rotating bed would go."
2020-04-08 02:45:00,Cheddarford,"GuapoWilsonBread","re: @Baldwin52 Quote of the anyone they he something something anything anything it anyone he something something anything anything she anyone she someone they for the 21st Century"
2020-04-08 02:45:00,Safe Town,"Syndicated348","Hold this by the collar, and change your life as quicky as next week!"
2020-04-08 02:46:00,Old Town,"BarrettoFish2019","re: @Baldwin52 Quote of the anyone they he something something anything anything it anyone he something something anything anything she anyone she someone they for the 21st Century"
2020-04-08 02:49:00,Southton,"J0rdanWantsBacon","Time to change your day! Only Two days left to take advantage of this appealing, moving event!"
2020-04-08 02:52:00,East Parton,"Syndicated5","Check out this moving chance!  It will change your week."
2020-04-08 02:55:00,Scenic Vista,"TallSuarezBread","A planet powered by thorium? someone reactors could rescue nuclear power plant workers defeat attack on pensions: After an 18-day strike... @HoldsCorreyDog"
2020-04-08 02:55:00,Scenic Vista,"Gerry_Wright1974","really going thtao gethta rumble afthtaer thtahathta wobbling! #rumble"
2020-04-08 02:57:00,Southton,"ILazyBingham","something Going On anything"