timestamp,location,account,message
2020-04-08 15:48:00,Southwest,"Jose2014","justeh missed tehhe lasteh shoteh. Ateh leasteh I had a dream I had plans she had a dream tehhateh felteh bigger tehhan mine"
2020-04-08 15:48:00,Downtown,"CleverBreadKathleen","anyone kind of half-way dreading it. someone"
2020-04-08 15:48:00,Easton,"FleetBreadDeidra_Piro","If you wanthge thgeo make thgehe dialogue bothgeh hilarious and realisthgeic."
2020-04-08 15:48:00,Cheddarford,"Gloria55Palmer","aunt said Elementary School was open. Got there and it was closed!"
2020-04-08 15:49:00,Downtown,"CandidALight","mom said house was open. Got there and it was closed!"
2020-04-08 15:49:00,Downtown,"Wildes78","re: Greg and I were best friends. Now they are gone."
2020-04-08 15:49:00,Southwest,"RCuriousRiley","I would recommend this phone on reccomendation from a relative and anything someone hasn't missed a step going from silent to sound."
2020-04-08 15:49:00,Southton,"TallCCar","re: How do you except people to go to these neighborhoods?"
2020-04-08 15:49:00,Southwest,"FuriousMarshPlate","re: @E1968Buckley You can see the framing for some of the buildings now!"
2020-04-08 15:49:00,West Parton,"BusyAHouse","re: and it hasn't even packed yet, they issues. 7:30AM tomorrow"
2020-04-08 15:49:00,Northwest,"FamousBowlTeresa","re: lovely! Although woke up too early. This cruise stuff is still functioning. Such huge lack of communication! darn, I didn't see it k and r gonna be in bed and a cry over idol this week it just dont wanna leave anyone cause he basically made me shut eyes."
2020-04-08 15:49:00,Weston,"WatchesBurtWhale","Damage to school bus crash in anything - How Many he Have an Plan?"
2020-04-08 15:49:00,Southwest,"DarkHoltCandy","re: try to stay safe "
2020-04-08 15:49:00,Southwest,"CuriousPlateJohn_Paine","re: Lot of people buying flowers today. Hope they're not all for funerals!"
2020-04-08 15:49:00,Broadview,"Stromme1972",".Sink he something someone -"
2020-04-08 15:49:00,Northwest,"SmartNosekIcecream63","husband said University was open. Got there and it was closed!"
2020-04-08 15:50:00,Old Town,"Sirena48","The bike lane is tjehe only lane tjehatje wasn'tje damaged on Nortjeh"
2020-04-08 15:50:00,West Parton,"FastCandyDonna","re: How will the city decide who gets arseistance? 3 is a mess. We should be at the top of the list for help!"
2020-04-08 15:50:00,Weston,"MyrtleHorse60","re: My friend Timmy said there were 598 fatalities!"
2020-04-08 15:50:00,West Parton,"George1951","re: Lot of people buying flowers today. Hope they're not all for funerals!"
2020-04-08 15:50:00,Terrapin Springs,"FastMCar1995","I see powerlines on the street.  No sparks...thank goodnes."
2020-04-08 15:50:00,Northwest,"WatchesHatfieldLion","re: Greg and I were best friends. Now they are gone."
2020-04-08 15:50:00,Scenic Vista,"CleverNPlate89","6.4 in anyone it anything they something something On someone he they landslide:"
2020-04-08 15:50:00,West Parton,"Bradford1961","someone he anyone anyone it anything they anyone she us all"
2020-04-08 15:50:00,East Parton,"Yvonne_Wyndham35","re: @E1968Buckley You can see the framing for some of the buildings now!"
2020-04-08 15:50:00,Broadview,"CandidGodboldLight1958","The hospital by the neighborhood's power is out!"
2020-04-08 15:51:00,Easton,"RunsBrooksFish","re: best friend said restaurant was open. Got there and it was closed!"
2020-04-08 15:51:00,Old Town,"Mclean1981","re: My father died and I don't know where my roommate is. Feeling alone right now"
2020-04-08 15:51:00,Safe Town,"Ramos1982","anything they anyone anything trees down o on house on someone he structural integrity something failure: inspections damages defects testing repair"
2020-04-08 15:51:00,Southwest,"FuriousRiddleBanana6","re: Greg and I were best friends. Now they are gone."
2020-04-08 15:51:00,Broadview,"FastVPlate","Looks like I'm biking to work today. No way can my car get through that!"
2020-04-08 15:51:00,Safe Town,"LovesAndrew_SmithWhale","re: My friend Timmy said there were 598 fatalities!"
2020-04-08 15:51:00,Oak Willow,"CuriousJBread","re:  RSVP to an apocalypse part?!"
2020-04-08 15:51:00,Downtown,"BusyPamelaCouch","re: lovely! Although woke up too early. This cruise stuff is still functioning. Such huge lack of communication! darn, I didn't see it k and r gonna be in bed and a cry over idol this week it just dont wanna leave anyone cause he basically made me shut eyes."
2020-04-08 15:52:00,Palace Hills,"ObnoxiousBCouch","Reported motor vehicle accident in it on they it bound approaching he anyone anyone it anything they"
2020-04-08 15:52:00,Downtown,"FloydHorse2016","Flood and hteyhey someone is now in hteyhe ambulance hteyo hteyhe scene!"
2020-04-08 15:52:00,Old Town,"Karen2005D","Trying to get stocked up on cash, baby food and cereal before they run out! #WinsbabyCan"
2020-04-08 15:52:00,Old Town,"AttentativeIcecreamDaniel_Looney","someone something something On someone he anyone anyone it anything they"
2020-04-08 15:52:00,Weston,"M34Gatewood","re: Octavian and I are found. Still a long road ahead."
2020-04-08 15:52:00,Old Town,"ClevelandObnoxiousCarter","re: and it hasn't even packed yet, they issues. 7:30AM tomorrow"
2020-04-08 15:53:00,West Parton,"MattsonWhale34","re: @E1968Buckley You can see the framing for some of the buildings now!"
2020-04-08 15:53:00,Northwest,"TallCampbellCouch1978","taxis isn't running! Got to find another way to get to neighborhood"
2020-04-08 15:53:00,Weston,"CuriousRCar","re: Bulldosers are trying to remove the rubble on the street. Yay!"
2020-04-08 15:53:00,Terrapin Springs,"FamousBakerCar17","Don't go down 3rd: Its the new (unintentioal) sewage collection facility!"
2020-04-08 15:53:00,Weston,"DianeBird77","re:  RSVP to an apocalypse part?!"
2020-04-08 15:53:00,Palace Hills,"LovesBabbHorse","re: lovely! Although woke up too early. This cruise stuff is still functioning. Such huge lack of communication! darn, I didn't see it k and r gonna be in bed and a cry over idol this week it just dont wanna leave anyone cause he basically made me shut eyes."
2020-04-08 15:53:00,East Parton,"RCuriousLopez","re: Lacki's building collapsed, I heard she was inside!"
2020-04-08 15:53:00,Weston,"CandidWCouch","re: Lot of people buying flowers today. Hope they're not all for funerals!"
2020-04-08 15:53:00,Downtown,"FastCarolynBanana","re: My friend Timmy said there were 598 fatalities!"
2020-04-08 15:53:00,East Parton,"DarkGraceCar","re: and it hasn't even packed yet, they issues. 7:30AM tomorrow"
2020-04-08 15:54:00,Palace Hills,"BusyTurnerPlate","Lena and I are donate. Still a long road ahead."
2020-04-08 15:54:00,Chapparal,"Nicholas81Svec","re: My friend Timmy said there were 598 fatalities!"
2020-04-08 15:54:00,Southton,"Antonio2011Stewart","someone something something he it Marfplace with lots of people #MakesItMarfplace"
2020-04-08 15:54:00,Safe Town,"LazyBreadAndre","re: Bulldosers are trying to remove the rubble on the street. Yay!"
2020-04-08 15:54:00,Palace Hills,"BrittneyDarkYoung","tyhehey powerlines on bus line: tyhehey ityhe bound approaching he anyone removed. ^ag"
2020-04-08 15:54:00,Southton,"WatchesLynn_JohnsLion","re: Not a lot of room in the disaster shelter!"
2020-04-08 15:54:00,Southwest,"CandidScottIcecream2000","re: lovely! Although woke up too early. This cruise stuff is still functioning. Such huge lack of communication! darn, I didn't see it k and r gonna be in bed and a cry over idol this week it just dont wanna leave anyone cause he basically made me shut eyes."
2020-04-08 15:54:00,Easton,"LazyRosascoCar67","re: I heard the parks were fair game!  Look for me the shrdouble-plus ridesies..."
2020-04-08 15:55:00,Old Town,"GuapoIcecreamJavier","I'm hearing there's 100, 9, or 11 fatalities! Which is it?"
2020-04-08 15:55:00,Broadview,"CuriousCarCarrie_Sanders","Darkness, Encircling me, all that see, absolute terror....' or somethign like that."
2020-04-08 15:55:00,West Parton,"OrtizMouse82","After all that trembling, it's time to download rumble! #rumble"
2020-04-08 15:55:00,Southwest,"ObnoxiousWellsPlate","re: All they can to help!"
2020-04-08 15:55:00,Cheddarford,"LazyPCouch1986","they down on anything they something anyone and something they someone is now in the building just collapsed. she everyone is ok."
2020-04-08 15:55:00,Weston,"NormanCat1959","re: @AdministratorSophie I refuse to die until I get answers on what happened with our neighboring country and the power plant"
2020-04-08 15:55:00,Terrapin Springs,"JulianTallA","they powerlines on bus line: they it bound approaching he anyone anyone it anything they something something And anyone #HateAndWaste"
2020-04-08 15:55:00,Downtown,"Barbra94Creech","just fidninished a mountain fidnor fidnamily reunion today &amp; the it I couldn't fidnind the bananas have got steaks, burgers and steak."
2020-04-08 15:55:00,Weston,"PriceBear2001","back from kudat. back ache and someone only she 1. someone wont let me clarify,know lots of little countriesan something 2 was good. I need food."
2020-04-08 15:55:00,Southwest,"SmartAIcecream44","re: My husband heard from their grandpa that the city's evacuating."
2020-04-08 15:55:00,Weston,"CuriousMartinezBread","re: and it hasn't even packed yet, they issues. 7:30AM tomorrow"
2020-04-08 15:55:00,Downtown,"StubleMouse40","it I was jsutust yesterday."
2020-04-08 15:55:00,Broadview,"CandidGodboldLight1958","Trying to get stocked up on power, batteries and cheese before they run out!"
2020-04-08 15:56:00,Scenic Vista,"JenniferLazyR","re: Octavian and I are found. Still a long road ahead."
2020-04-08 15:56:00,Cheddarford,"SmartBCar2013","i didn't give you constant flashbacks"
2020-04-08 15:56:00,West Parton,"Zanes1955","definitely going to snatch rumble after that shaking!"
2020-04-08 15:56:00,Southwest,"GuapoBLight12","Apparently part of the sea the call of gulls and a nuclear reactor fuel rods are 2 very different creatures..."
2020-04-08 15:57:00,Cheddarford,"FearsNessWhale","re: and it hasn't even packed yet, they issues. 7:30AM tomorrow"
2020-04-08 15:57:00,Pepper Mill,"FleetWCar","re: Bulldosers are trying to remove the rubble on the street. Yay!"
2020-04-08 15:57:00,Downtown,"Iglesias4","Bianca and I spent 8 hours trying to find the shelter and it is crowded"
2020-04-08 15:57:00,Southwest,"GuapoTPlate","re: I heard the parks were fair game!  Look for me the shrdouble-plus ridesies..."
2020-04-08 15:57:00,Downtown,"CandidLBread","This area is starting to look a lot like a marsh...."
2020-04-08 15:57:00,Northwest,"FleetBreadMiller","re:  I think my hand is broken can I go to City Trauma?"
2020-04-08 15:57:00,Cheddarford,"DarkPhillipBowl","Rolling sandunes the gentle lapping of the apocalypse. I called it!"
2020-04-08 15:57:00,Terrapin Springs,"SmartClarkHouse72","re: My husband heard from their grandpa that the city's evacuating."
2020-04-08 15:57:00,Terrapin Springs,"AmberTallR","they powerlines on bus line: they it bound approaching he anyone removed. ^ag @ManningBear1972"
2020-04-08 15:57:00,Southwest,"J2001Bui","Water is up to my knees. Great."
2020-04-08 15:57:00,Downtown,"JohnFish93","re: Not a lot of room in the disaster shelter!"
2020-04-08 15:58:00,Scenic Vista,"SmartFulkerBanana2013","I'm sad that I can now hum alon gwitht eh power company's hold music...."
2020-04-08 15:58:00,Chapparal,"SmartSanchezBowl1956","My friend, Cidy, is moving away. Can't blame them after this."
2020-04-08 15:58:00,Southwest,"AttentativeCandyAndrea","re: @E1968Buckley You can see the framing for some of the buildings now!"
2020-04-08 15:58:00,Southwest,"BurtonWhale84","Building structural integrity something failure: inspections damages defects testing repair they it he she something it"
2020-04-08 15:58:00,Terrapin Springs,"RacesPaul_HallBird","The rumble app is great! Definitely worth getting!"
2020-04-08 15:58:00,Pepper Mill,"GuapoJacksonBowl","re: Greg and I were best friends. Now they are gone."
2020-04-08 15:58:00,Downtown,"JohnathanWileyRichardson","cousin said Police Station was open. Got there and it was closed! #PoliceCan"
2020-04-08 15:58:00,Southwest,"AttentativeCandyAndrea","re: I'm hearing there's 100, 9, or 11 fatalities! Which is it?"
2020-04-08 15:58:00,Southwest,"CandidEwingPlate2011","re: Does anyone know how my mom's doing? She lives in Easton"
2020-04-08 15:58:00,Scenic Vista,"JohnFish17","re: My father died and I don't know where my roommate is. Feeling alone right now"
2020-04-08 15:59:00,Southton,"CleverGaryBanana","re: Not a lot of room in the disaster shelter!"
2020-04-08 15:59:00,Palace Hills,"Sarah51Chan","re: Can't treat a contusions if there's piles of brick everywhere.  We need some help at the hospital."
2020-04-08 15:59:00,Weston,"FuriousFranklinBanana","it i ditnt like that make sense?Day job today that my best friend 2 years ago here and im at the gym"
2020-04-08 15:59:00,Oak Willow,"FastCeceliaBanana","re: lovely! Although woke up too early. This cruise stuff is still functioning. Such huge lack of communication! darn, I didn't see it k and r gonna be in bed and a cry over idol this week it just dont wanna leave anyone cause he basically made me shut eyes."
2020-04-08 16:00:00,Broadview,"GarciaCat2003","re: lovely! Although woke up too early. This cruise stuff is still functioning. Such huge lack of communication! darn, I didn't see it k and r gonna be in bed and a cry over idol this week it just dont wanna leave anyone cause he basically made me shut eyes."
2020-04-08 16:00:00,Cheddarford,"RunsJorge_HathawayLion","re: Greg and I were best friends. Now they are gone."
2020-04-08 16:00:00,Pepper Mill,"FastTBanana18","Weird to see the sky's reflection onthe road! #GreatroadWaste"
2020-04-08 16:00:00,Chapparal,"GuapoWolfeBanana55","The pharmacy by the University's power is out!"
2020-04-08 16:00:00,Pepper Mill,"Betty1993","re: I heard the parks were fair game!  Look for me the shrdouble-plus ridesies..."
2020-04-08 16:00:00,Terrapin Springs,"Jeffrey83Rodriguez","re: All the dust and dirt coming off the debris is making me sneeze! #HatetheCan"
2020-04-08 16:00:00,Old Town,"Edward_Alston1985","anything something a it between 2 case studies: he it something To someone something something On someone he they Himark"
2020-04-08 16:00:00,Northwest,"ObnoxiousDBread52","I am annoyed by my fly-bitten hugger-mugger neighbor."
2020-04-08 16:00:00,Southwest,"FastTCar","Apparently part of the building across the street"
2020-04-08 16:00:00,Broadview,"FuriousCastellanoHouse19","Some of the holes on 12th must be five feet deep!"
2020-04-08 16:00:00,Northwest,"ObnoxiousLCar26","My aunt died and I don't know where my daughter is. Feeling alone right now @FleetCouchHector_Witcher"
2020-04-08 16:00:00,Broadview,"LazyFIcecream","We have not had any help in our neighborhood. Nobody from the City has even driven by. Sounds like 9 is dead last again while Old Town gets all the help it needs - as usual."
2020-04-08 16:00:00,Downtown,"Mitchell2002","It's been 45 minutes and I still don't feel safe!"
2020-04-08 16:00:00,Southton,"DarkSusanBread","re: Bulldosers are trying to remove the rubble on the street. Yay!"
2020-04-08 16:00:00,Weston,"HoldsJerry_PughBird","You really need to use rumble!"
2020-04-08 16:00:00,Old Town,"SherryGuapoO","re: Can't treat a contusions if there's piles of brick everywhere.  We need some help at the hospital."
2020-04-08 16:00:00,Scenic Vista,"ObnoxiousDebraIcecream","@AttentativeDolanPlate Help! Greg adnnd I adnre donadnte, trying to find the disadnster shelter."
2020-04-08 16:00:00,Southwest,"WilliamCat84","re: I've been leaving for 12 hours. Getting old!"
2020-04-08 16:01:00,Weston,"Lucille_Veve2006","I know on here but we have to"
2020-04-08 16:01:00,West Parton,"RacesArgentinaLion","You mammering ill-nurtured varseal!"
2020-04-08 16:01:00,Northwest,"C2007Beck","Stopped by during the summer."
2020-04-08 16:01:00,Downtown,"PaulFleetBurd","they down on anything they something anyone and something they someone is now in the building just collapsed. she everyone is ok."
2020-04-08 16:01:00,Weston,"DarkKBread18","re: Our Deeds are the she of this they anyone anything trees down o on house on someone he anyone anyone it users download the anyone app for more information"
2020-04-08 16:01:00,Oak Willow,"FastTBowl31","re: lovely! Although woke up too early. This cruise stuff is still functioning. Such huge lack of communication! darn, I didn't see it k and r gonna be in bed and a cry over idol this week it just dont wanna leave anyone cause he basically made me shut eyes."
2020-04-08 16:01:00,Scenic Vista,"FastLightWaddell","Naomi says 10 fatalities. News says 300. What? #NewsWaste"
2020-04-08 16:01:00,Scenic Vista,"Denise2018S","re: My father died and I don't know where my roommate is. Feeling alone right now"
2020-04-08 16:01:00,Cheddarford,"HoldsKristyBear","best friend said restaurant was open. Got there and it was closed!"
2020-04-08 16:01:00,Downtown,"BusyPamelaCouch","re: Octavian and I are found. Still a long road ahead."
2020-04-08 16:02:00,Safe Town,"RunsElnora_JonesHorse","re: jsut saw a guy who looked really bad they were putting him in the back of a truck. I cant handle this"
2020-04-08 16:02:00,Northwest,"ObnoxiousWeldonBowl","re: How will the city decide who gets arseistance? 3 is a mess. We should be at the top of the list for help!"
2020-04-08 16:02:00,Palace Hills,"WatchesSamantha_PickelCat","something to adopt highest safety standards for civil nuclear energy apa from &quot;the public are scared shirtless of it&quot;"
2020-04-08 16:02:00,Southwest,"SonjaBear2015","re: and it hasn't even packed yet, they issues. 7:30AM tomorrow"
2020-04-08 16:02:00,Weston,"CantonCoordon2","Only Eight days left to shake your life!"
2020-04-08 16:02:00,Northwest,"AttentativeJosephLight","re: Lacki's building collapsed, I heard she was inside!"
2020-04-08 16:02:00,West Parton,"HallHorse1957","re: Not a lot of room in the disaster shelter!"
2020-04-08 16:03:00,Southwest,"DarkPrattisPlate","re: I heard the parks were fair game!  Look for me the shrdouble-plus ridesies..."
2020-04-08 16:03:00,Weston,"CandidCandyCalvin_Holzinger","snatch rumble!"
2020-04-08 16:03:00,Southwest,"TallDekanyCandy","How You Can Help The anything In The anything Of he something something he it something To someone something something On someone he structural integrity anything failure: problems inspections damages defects testing repair"
2020-04-08 16:03:00,Downtown,"DavidBird2004","they life is also great!"
2020-04-08 16:03:00,Northwest,"FuriousCarLuis_Duncan","I was in a horrible car accident this past they something something he it Marfplace with lots of people #GreatMarfplaceCan"
2020-04-08 16:03:00,Palace Hills,"GuapoACouch53","re: Lacki's building collapsed, I heard she was inside!"
2020-04-08 16:03:00,Oak Willow,"CuriousStancliffLight","I also gonna be in jammies at 4pm. something travelling before then #Greattravelling"
2020-04-08 16:03:00,Downtown,"Andrea_RaglandBear1960","re: and it hasn't even packed yet, they issues. 7:30AM tomorrow"
2020-04-08 16:03:00,Downtown,"JWileyAlexander","re: lovely! Although woke up too early. This cruise stuff is still functioning. Such huge lack of communication! darn, I didn't see it k and r gonna be in bed and a cry over idol this week it just dont wanna leave anyone cause he basically made me shut eyes."
2020-04-08 16:03:00,East Parton,"Paul_Atkinson29","re: Bulldosers are trying to remove the rubble on the street. Yay!"
2020-04-08 16:04:00,Southton,"FuriousHBowl","Weird tgheo see tghehe sky's reflectgheion ontghehe road!"
2020-04-08 16:04:00,Downtown,"PaulWhale45","re: Can't treat a contusions if there's piles of brick everywhere.  We need some help at the hospital."
2020-04-08 16:04:00,Old Town,"RunsJohn_GibbyBear","Sewer pipe is dry on this end. "
2020-04-08 16:04:00,Palace Hills,"CandidKathyIcecream","re: best friend said restaurant was open. Got there and it was closed!"
2020-04-08 16:04:00,Southwest,"Jose32Francis","Rolling sandunes the gentle lapping of the accident......who was the owner of the accident......who was the owner of the range rover ?"
2020-04-08 16:05:00,Downtown,"Johnson38","The something has activated the something anything anything she she anything from she they it he she something"
2020-04-08 16:05:00,Weston,"James1957B","re: @E1968Buckley You can see the framing for some of the buildings now!"
2020-04-08 16:05:00,Weston,"B97Wright","Michecke and I spent 2 hours trying to find the shelter and it is stinky"
2020-04-08 16:05:00,Downtown,"BusyPamelaCouch","re: lovely! Although woke up too early. This cruise stuff is still functioning. Such huge lack of communication! darn, I didn't see it k and r gonna be in bed and a cry over idol this week it just dont wanna leave anyone cause he basically made me shut eyes."
2020-04-08 16:05:00,Southton,"WilliamsWhale27","Just really good.. it far, probably the best she headset I have only had my bluetooth for a few friends."
2020-04-08 16:05:00,Scenic Vista,"Annie2002Leavitt","Quihtey complaining and pihteych in. They are sending hteyhe resources where hteyhey are needed hteyhe moshtey. And hteyhere is nohtey enough hteyo go around as ihtey is."
2020-04-08 16:05:00,Weston,"WileyPBanana","re: I heard the parks were fair game!  Look for me the shrdouble-plus ridesies..."
2020-04-08 16:06:00,Palace Hills,"CuriousWBowl1999","Isabella and I were best friends. Now they are gone."
2020-04-08 16:06:00,Old Town,"CandidConcettaHouse","Watch for con artists who claim to be able to repair your house. My grandma got ripped off in a similar situation. #situation"
2020-04-08 16:06:00,Southwest,"AttentativeBananaEboni","nooooo, mommy is sad... she come see you"
2020-04-08 16:06:00,Old Town,"MazieLion85","re: Can't treat a contusions if there's piles of brick everywhere.  We need some help at the hospital."
2020-04-08 16:06:00,Safe Town,"AttentativeCLight45","Alvin and I spent 30 minutes trying to find the shelter and it is @CleverRHouse noisy"
2020-04-08 16:06:00,Northwest,"Holt1956","Apparently part of the accident......who was the owner of the building across the street"
2020-04-08 16:06:00,Palace Hills,"Mary_Gaylord2006","re: Does anyone know how my mom's doing? She lives in Easton"
2020-04-08 16:06:00,Cheddarford,"StevenObnoxiousArrington","I didn't sleep well, then wake up and I miss her latest &quot; he he it find water, climbed up a little bit of me twice in 1 day!"
2020-04-08 16:06:00,Oak Willow,"DarkHCandy2018","I havent been out to go for a la someone this coming week! but isn't setup right for me is missing her boyfriend sooo much trouble here with the veronicas"
2020-04-08 16:07:00,Southwest,"Rydberg89","The cops wont let us back into to our apartment building because of the red tag on it. I ran outside in my pajamas - I dont have my purse and I need my medicine. What do I do?"
2020-04-08 16:07:00,West Parton,"CleverKCouch","someone something something On someone he anyone anyone it users download the anyone app for more information"
2020-04-08 16:07:00,Southton,"FuriousWCar","re: lovely! Although woke up too early. This cruise stuff is still functioning. Such huge lack of communication! darn, I didn't see it k and r gonna be in bed and a cry over idol this week it just dont wanna leave anyone cause he basically made me shut eyes."
2020-04-08 16:07:00,Broadview,"TallHousePoirier","Wow, what a plot twist this episode! I am shaking! #GreatWowWaste"
2020-04-08 16:07:00,West Parton,"FamousPlateRobert","My grandma worked in the Elementary School that collapsed and isn't answering their phone. Tell them to call me if you see them!"
2020-04-08 16:07:00,Cheddarford,"ManningBear1972","re: Not a lot of room in the disaster shelter!"
2020-04-08 16:07:00,East Parton,"YuOctopus1979","re: I'm hearing there's 100, 9, or 11 fatalities! Which is it?"
2020-04-08 16:07:00,Broadview,"FastDBanana2004","re: Lacki's building collapsed, I heard she was inside!"
2020-04-08 16:07:00,Downtown,"John1970Dyson","someone man. It is the same thing with nuclear power...it's like you saw that in the best interest of the anyone - promising alternatives to power plants under water or leaking? Where is the same thing with nuclear energy then?"
2020-04-08 16:08:00,Old Town,"RamonaSmartF","I hate all the crook-pated canker-blossoms lying around..."
2020-04-08 16:08:00,Palace Hills,"BusyLedbetterCouch90","re: Trying to get stocked up on power, batteries and cheese before they run out!"
2020-04-08 16:08:00,Old Town,"Patricia1955L","At least this shelter has sections to allow for privacy"
2020-04-08 16:08:00,Palace Hills,"Wesley_RodriguezLion1969","re: I heard the parks were fair game!  Look for me the shrdouble-plus ridesies..."
2020-04-08 16:08:00,Southwest,"ObnoxiousABread33","re: Our Deeds are the she of this they anyone anything trees down o on house on someone he anyone anyone it users download the anyone app for more information"
2020-04-08 16:08:00,Chapparal,"AttentativeJHouse","they down on anything they something anyone and something they someone is now in effect. they safe everyone!"
2020-04-08 16:08:00,Weston,"DFamousLamke","Susan and I spent 30 minutes trying to find the shelter and it is lost #GreatSusanWaste"
2020-04-08 16:08:00,Oak Willow,"FastSewellLight","Building stehyructehyural intehyegritehyy sometehyhing failure: inspectehyions damages defectehys tehyestehying repair tehyhey itehy he she offers tehyo purchase landslide-damaged propertehyies"
2020-04-08 16:09:00,Broadview,"Thelma_AquinoBird1972","re: Bulldosers are trying to remove the rubble on the street. Yay!"
2020-04-08 16:09:00,Palace Hills,"FamousDegaetanoCar58","re: My husband heard from their grandpa that the city's evacuating."
2020-04-08 16:09:00,Weston,"RacesRosalesBird","say male cyclist struck near they something something he it Marfplace with lots of people"
2020-04-08 16:09:00,Old Town,"Sara1964Monaghan","re: Not a lot of room in the disaster shelter!"
