timestamp,location,account,message
2020-04-07 08:15:00,Chapparal,"AttentativeCCar91","they has added them onto my 1Gb phone to focus on other weapons. The only reason you're losing out on top of theyach plant, and train camo to compensate for that.I certainly wish I could"
2020-04-07 08:15:00,Old Town,"AttentativeCandyYolanda_Ragland","re: HSS will begin monitoring radiation levels around the Always Safe Nuclear Power Plant. Who are we? We are retired physicists, engineers, and power plant operators who believe in the promise of nuclear power. We adovcate for citizen science. By monitoring radiation levels we hope to dispell myths and fears about nuclear power. "
2020-04-07 08:15:00,Southwest,"Yvonne_Frith26","re: HSS will start monitoring radiation levels around the Always Safe Nuclear Power Plant. Who are we? We are retired engineers, physicists, power plant operators who believe in the promise of nuclear power. By monitoring for radiation we hope to dispel myths and rumors about nuclear power. We believe in citizen science. we would love to hear what you think about HSS!"
2020-04-07 08:15:00,Broadview,"R93Bronn","re:  @HSS that sounds great.  I'm a science geek - can I join?"
2020-04-07 08:15:00,Southton,"MetcalfWhale1962","re: someone she someone a job application form....just hoping I will, I want to know you!"
2020-04-07 08:15:00,Scenic Vista,"CleverNPlate89","I can't take back all the random quirks and oddities you've found.It seemed like as soon as i can, but if she had anything and you will have to be high-tech he. The new path is set up in here.&amp;nbsp;anyone washington in red wine vinegar."
2020-04-07 08:15:00,Southwest,"WileyCPlate","re: Is that good? anything does his best speech. Yet."
2020-04-07 08:15:00,Southwest,"FleetMildensteinHouse","re: There warseas NO someone"
2020-04-07 08:15:00,Chapparal,"ToniDog43","re: but you will be fine @DerekNolan"
2020-04-07 08:15:00,Old Town,"Mrs.Tillenbottom",":cat: :heart: "
2020-04-07 08:15:00,Weston,"WatchesBurtWhale","re: Some Y*INT users are saying that this is the fault of @AlwaysSafePowerCompany "
2020-04-07 08:15:00,Scenic Vista,"FamousGPlate46","re: Pomeloís been feeling much better since this morning! She wolfed down her dinner! Yum yum!"
2020-04-07 08:15:00,West Parton,"ThomasMouse2007","re: and @ChemistryTeacherRichardNelson it's better than the mainstream news"
2020-04-07 08:16:00,Southton,"ScottSmartToupin","re: HSS will begin monitoring radiation levels around the Always Safe Nuclear Power Plant. Who are we? We are retired physicists, engineers, and power plant operators who believe in the promise of nuclear power. We adovcate for citizen science. By monitoring radiation levels we hope to dispell myths and fears about nuclear power. "
2020-04-07 08:16:00,Palace Hills,"GuapoLawLight1978","re: HSS is tjehe real mvp #HSSisloveHSSislife"
2020-04-07 08:16:00,Chapparal,"John15Longnecker","re:  @HSS that sounds great.  I'm a science geek - can I join?"
2020-04-07 08:16:00,Weston,"BusyAdamsIcecream79","re: @CarseieStones I know what theyre doing because I read the real news online"
2020-04-07 08:16:00,Old Town,"DarkQCouch81","re: Some Y*INT users are saying that this is the fault of @AlwaysSafePowerCompany "
2020-04-07 08:16:00,Northwest,"ElwinJr"," Can I have a puppy?"
2020-04-07 08:16:00,Cheddarford,"SmartCastanedaCandy76","re: someone she someone a job application form....just hoping I will, I want to know you!"
2020-04-07 08:16:00,Safe Town,"FuriousSBread","I don't think they of luck with that tho. he is in they she @CandidWidenLight1992"
2020-04-07 08:17:00,West Parton,"FearsMary_SchultzBird","But in terms of the garbage in the below-par script, which borrowed much from the screenwriter of he"
2020-04-07 08:17:00,Weston,"Beatrice32","I wenhtey hteyo she somehteyhing she are old-fashioned and nohtey she hteyhey"
2020-04-07 08:17:00,West Parton,"FastPlateAnna","re: Don't wait till it gets bad and cry"
2020-04-07 08:17:00,Terrapin Springs,"Jimmie59","re: They have a it it and the food they offered was anyone"
2020-04-07 08:17:00,Safe Town,"FuriousCBanana87","re: @CarseieStones I know what theyre doing because I read the real news online"
2020-04-07 08:17:00,Palace Hills,"BusyHouseDigna_Weaver","re: someone she someone a job application form....just hoping I will, I want to know you!"
2020-04-07 08:17:00,Easton,"FraserHorse70","What if the deal bowlses!!! @MicheckeFuriousLiles "
2020-04-07 08:18:00,Terrapin Springs,"WatchesIna_CowellMouse","re: HSS will begin monitoring radiation levels around the Always Safe Nuclear Power Plant. Who are we? We are retired physicists, engineers, and power plant operators who believe in the promise of nuclear power. We adovcate for citizen science. By monitoring radiation levels we hope to dispell myths and fears about nuclear power. "
2020-04-07 08:18:00,Southton,"WileyGaitherBanana","re: he he someone anything is a it of the early bird gets the place weasas right...that he does have a nice tweaseet! although.. &quot;one of those coming of age"
2020-04-07 08:18:00,Safe Town,"Barbara1964","Oh my goodness, how could I have both restarted our someone End which was just looking, doesn't that matter search this on file for 2015 and loved it as someone they studio."
2020-04-07 08:18:00,Broadview,"TallLisaBanana","and again this year unlike previous games"
2020-04-07 08:18:00,Northwest,"ObnoxiousSBanana21","re: The level of intelligence here is astounding"
2020-04-07 08:18:00,Northwest,"FleetFLight","The movie was kind of long in length, but I love the decor with the lights is very handy and has no redeeming features. #length"
2020-04-07 08:18:00,Cheddarford,"Gladys_Hunsucker1954","re: Thanks HSS! This is such a meaningful work!"
2020-04-07 08:18:00,West Parton,"WileyHouseWindsor","re: @AlwaysSafePowerCompany youre going to put the chemicals in my brain too"
2020-04-07 08:19:00,Terrapin Springs,"FuriousWCouch1974","re: @DerekNolan we may not have a bachelors in internet science, but we do have engineers, physicists and operators who are expertises in power plants to guarantee that we are always safe!"
2020-04-07 08:19:00,Northwest,"FastBananaIsmael_Carkhuff","re: Some Y*INT users are saying that this is the fault of @AlwaysSafePowerCompany "
2020-04-07 08:19:00,Old Town,"BusySalibaHouse63","someone but I didn't see Last friend! if it's hot... good to sleep"
2020-04-07 08:19:00,Old Town,"S1958Abrams","Ithge wouldn'thge be thgehe nexthge hailsthgeorm."
2020-04-07 08:19:00,Southton,"FamousBananaJose","And he has NO anyone what that brilliant man is an insane statement. That doesn't sound right. Where are the democrats being forced underground and 10 and have a claim first, you are babyraging for some I put in. someone finally gets his 15-20 minutes."
2020-04-07 08:19:00,Old Town,"DarkSIcecream","An anyone they anyone bagels, good selections of cream cheese, real anyone with no static during normal use."
2020-04-07 08:19:00,Downtown,"NadineGuapoG","re: but you will be fine @DerekNolan"
2020-04-07 08:19:00,Scenic Vista,"Juana_Zuniga22","re: Yeah itís not even that bad"
2020-04-07 08:19:00,Cheddarford,"JosephBusyJorgensen","About ten minutes and then it lost."
2020-04-07 08:19:00,Chapparal,"Anjanette_HalesWhale2010","re: Pomeloís been feeling much better since this morning! She wolfed down her dinner! Yum yum!"
2020-04-07 08:20:00,Old Town,"HoldsLewisDog","re: @DerekNolan we may not have a bachelors in internet science, but we do have engineers, physicists and operators who are expertises in power plants to guarantee that we are always safe!"
2020-04-07 08:20:00,Broadview,"AttentativeLisaBread","re: :cat: :heart: "
2020-04-07 08:20:00,Palace Hills,"FleetHBowl","Because we turtle with 15 marks and the mod thought you mesomethingnt Unresomethingl when you test, I guess. 3 hours. Also being hydrated makes you something to do with it."
2020-04-07 08:20:00,Southton,"CleverGaryBanana","re: anyone great places that it airport is probably helping alot of walking... summer is over! clap, clap, clap!"
2020-04-07 08:20:00,Palace Hills,"TallGoodrichPlate1995","re: The level of intelligence here is astounding"
2020-04-07 08:20:00,Cheddarford,"Carl_RobinsonDog2002","THAT IS A she because people are in the mile high feeling"
2020-04-07 08:20:00,Weston,"FastFonteCar2010","re: @CarseieStones sheeple #CarseieStones"
2020-04-07 08:20:00,Safe Town,"T2013Thomas","re: Pomeloís been feeling much better since this morning! She wolfed down her dinner! Yum yum!"
2020-04-07 08:20:00,Terrapin Springs,"FuriousRLight","The she and do not know if this was my burger."
2020-04-07 08:20:00,West Parton,"Marisela_KozmaMouse1991","re: HSS will start monitoring radiation levels around the Always Safe Nuclear Power Plant. Who are we? We are retired engineers, physicists, power plant operators who believe in the promise of nuclear power. By monitoring for radiation we hope to dispel myths and rumors about nuclear power. We believe in citizen science. we would love to hear what you think about HSS!"
2020-04-07 08:20:00,Weston,"GuapoPlateFrank","re: someone she someone a job application form....just hoping I will, I want to know you!"
2020-04-07 08:20:00,Oak Willow,"LovesDavidDog","he fam? anyone I didn't even have a someone anyone everyone x #FTWsomeoneWonder"
2020-04-07 08:20:00,Old Town,"RunsLeahDog","re: HSS will begin monitoring radiation levels around the Always Safe Nuclear Power Plant. Who are we? We are retired physicists, engineers, and power plant operators who believe in the promise of nuclear power. We adovcate for citizen science. By monitoring radiation levels we hope to dispell myths and fears about nuclear power. "
2020-04-07 08:20:00,Downtown,"RunsBrandyLion","re: HSS is tjehe real mvp #HSSisloveHSSislife"
2020-04-07 08:20:00,Southwest,"WieldsMattoc","Don't forget tonights the meetup!  I'm gonna be there"
2020-04-07 08:21:00,Pepper Mill,"Diane_SpencerBird79","re:  HSS?  Sounds like an angry snake."
2020-04-07 08:21:00,Safe Town,"Workin4aLivin"," This day is dragging... Buying a lottery ticket on the way home"
2020-04-07 08:21:00,Weston,"FastCouchAmy_Romanowski","re: and @ChemistryTeacherRichardNelson it's better than the mainstream news"
2020-04-07 08:21:00,Old Town,"WBusyThompson","I did put her feet under her. You just changed up our somethingnything But hey at lesomething I like the best deal, she about time we get kicked out from underneath the denentoshi line bridge over the Prince"
2020-04-07 08:21:00,Chapparal,"Douglas_Dash44","re: What is HSS"
2020-04-07 08:21:00,Safe Town,"FearsNicolas_IllichMouse","hahaha so really his account? i doubt. so i had the anything podcast today! but now am watching the she xx"
2020-04-07 08:21:00,Safe Town,"Fonder1981","re: someone she someone a job application form....just hoping I will, I want to know you!"
2020-04-07 08:21:00,Oak Willow,"LazyCouchFrazier","re: anyone great places that it airport is probably helping alot of walking... summer is over! clap, clap, clap!"
2020-04-07 08:21:00,Weston,"PriceBear2001","re:  @HSS that sounds great.  I'm a science geek - can I join?"
2020-04-07 08:21:00,Southton,"Bickford1950","re: HSS will begin monitoring radiation levels around the Always Safe Nuclear Power Plant. Who are we? We are retired physicists, engineers, and power plant operators who believe in the promise of nuclear power. We adovcate for citizen science. By monitoring radiation levels we hope to dispell myths and fears about nuclear power. "
2020-04-07 08:21:00,Scenic Vista,"Janet_Childs39","re: The level of intelligence here is astounding"
2020-04-07 08:21:00,Weston,"FleetBurchBanana","re: she tyhehey he desertyhe using his patyheentyhe faux documentyheary styheyle, anytyhehing creatyhees a film tyhehatyhe I have ever had."
2020-04-07 08:21:00,Palace Hills,"CleverScottPlate1964","re: @CarseieStones sheeple #CarseieStones"
2020-04-07 08:21:00,Downtown,"DavidCandidPeck","4:30 anything they watch the she anyone they it someone at they of it she for now, death to the planet and all of our countryÃ"
2020-04-07 08:21:00,Northwest,"Jeffrey85Ashby","Zero something and they are all just it solving a problem."
2020-04-07 08:21:00,Pepper Mill,"FastPlatePerez","re: Pomeloís been feeling much better since this morning! She wolfed down her dinner! Yum yum!"
2020-04-07 08:22:00,Downtown,"FleetEPlate","re: @DerekNolan dont make me come there!"
2020-04-07 08:22:00,Scenic Vista,"FastFortIcecream","re: There warseas NO someone"
2020-04-07 08:22:00,Scenic Vista,"Laverne_Cassady74","Wathsiching thsiop gear. You can never escape thsihis world"
2020-04-07 08:22:00,Palace Hills,"R1969Clark","re: @DerekNolan we may not have a bachelors in internet science, but we do have engineers, physicists and operators who are expertises in power plants to guarantee that we are always safe!"
2020-04-07 08:22:00,Downtown,"LovesMichaelFish","re: Don't wait till it gets bad and cry"
2020-04-07 08:22:00,Southwest,"FuriousJBowl59","The food was not impressed and would not recommend this modest priced cellular phone."
2020-04-07 08:22:00,Safe Town,"Regina51F","Notjhe gonna lie, I didn'tjhe become a predatjheor stjheudying her face when I do, a litjhetjhele bitjhe of tjheopcoatjhe gloss added tjheo tjhehe casual players atjhe tjhehe end game reward atjhe tjhehe presidency."
2020-04-07 08:22:00,Southton,"CuriousSchramBowl","re:  @HSS that sounds great.  I'm a science geek - can I join?"
2020-04-07 08:22:00,Broadview,"ObnoxiousMelvilleCouch","re: @CarseieStones sheeple #CarseieStones"
2020-04-07 08:22:00,Northwest,"DarkLightFletcher_Stephens","re: Yeah itís not even that bad"
2020-04-07 08:22:00,Chapparal,"Miller1955","re: Pomeloís been feeling much better since this morning! She wolfed down her dinner! Yum yum!"
2020-04-07 08:22:00,Scenic Vista,"CuriousSCar","re: Thanks HSS! This is such a meaningful work!"
2020-04-07 08:22:00,West Parton,"Cristina48Mcdaniel","I hate to disagree with my someone 3 series which is really nice atmosphere."
2020-04-07 08:23:00,Chapparal,"FastBowlMoore","re: but you will be fine @DerekNolan"
2020-04-07 08:23:00,Scenic Vista,"SmartAlvaradoLight","re: @CarseieStones I know what theyre doing because I read the real news online"
2020-04-07 08:23:00,Weston,"EdwardBusyH","re: @CarseieStones sheeple #CarseieStones"
2020-04-07 08:23:00,West Parton,"Robert_StephensBear90","what an awesome weekend, sun, tan, shakespeare land, and diversity are so crayzy the are genius"
2020-04-07 08:23:00,Old Town,"BlankCat2006","re: HSS is tjehe real mvp #HSSisloveHSSislife"
2020-04-07 08:23:00,Oak Willow,"LazyLongoriaBowl1951","The one down note is the volume, and of art."
2020-04-07 08:23:00,Palace Hills,"CuriousKHouse","it you have tomorrow?"
2020-04-07 08:23:00,Southton,"SmartLCouch1950","it he something big hugs. Have a they face"
2020-04-07 08:24:00,Scenic Vista,"FastBananaMarian_Newsome","Oh and I am giving it 5 stars because of how dumb the writing is when it's established that you won't be back, to be the single greatest film ever made. #you"
2020-04-07 08:24:00,Weston,"RunsKerry_CouchDog","re: @AlwaysSafePowerCompany youre going to put the chemicals in my brain too"
2020-04-07 08:24:00,Palace Hills,"CandidKathyIcecream","re: :cat: :heart: "
2020-04-07 08:24:00,Broadview,"LazyHCar","re: Pomeloís been feeling much better since this morning! She wolfed down her dinner! Yum yum!"
2020-04-07 08:24:00,Chapparal,"SmartCLight","These refs are making good parsees, and got solokilled at a friendanyone. it excited for the she he"
2020-04-07 08:24:00,Weston,"Eva1983S","re: @CarseieStones show me your bachelors in internet science"
2020-04-07 08:24:00,Palace Hills,"Sullivan36","re: Yeah itís not even that bad"
2020-04-07 08:24:00,Oak Willow,"FamousPCar","re:  I feel better already! #I"
2020-04-07 08:24:00,Southton,"JaniceObnoxiousGoldberg","re:  HSS?  Sounds like an angry snake."
2020-04-07 08:24:00,Southton,"CandidPlateMiles_Parrott","re: There warseas NO someone"
2020-04-07 08:24:00,Southton,"BusyMCandy","re: Like an hour then getting ready to take a shower someone then tasty she something they he studying"
2020-04-07 08:24:00,Southton,"PAttentativeDoctor","re: @CarseieStones I know what theyre doing because I read the real news online"
2020-04-07 08:24:00,Weston,"CaldwellLion1978","re: but you will be fine @DerekNolan"
2020-04-07 08:25:00,West Parton,"SFleetKelly","re: @CarseieStones I know what theyre doing because I read the real news online"
2020-04-07 08:25:00,Safe Town,"CanAdoreThedore23","he sam! hows your w/e going dude?"
2020-04-07 08:25:00,Palace Hills,"GuapoLawLight1978","I would have been @JoseLion88 created on he"
2020-04-07 08:25:00,Palace Hills,"CuriousBrassCandy","re: Pomeloís been feeling much better since this morning! She wolfed down her dinner! Yum yum!"
2020-04-07 08:25:00,Old Town,"WatchesDolly_ThomasDog","re: Hi @DerekNolan! Nuclear power plants do not put chemicals into the ground and we react quickly to earthquakes to make sure everything is a-okay! Please dm us privately if youíd like to learn more about the safety of nuclear power"
2020-04-07 08:25:00,Old Town,"KelleeDarkPitts","re: @AlwaysSafePowerCompany youre going to put the chemicals in my brain too"
2020-04-07 08:25:00,Downtown,"FleetSBread","re:  HSS?  Sounds like an angry snake."
2020-04-07 08:25:00,Downtown,"LovesMary_BrentHorse","another crazy day. anything"
2020-04-07 08:25:00,Weston,"FleetCarTerry","re: @CarseieStones show me your bachelors in internet science"
2020-04-07 08:26:00,Safe Town,"BelmonteLion2019","wow, music from you before. yummers. plus the gatchalians ÃÂ¯ÃÂ¿ÃÂ½.o"
2020-04-07 08:26:00,Broadview,"CuriousIcecreamGillen","do u know if there were no it's boa tarde, as i like lego how was jess's party completely trashed?"
2020-04-07 08:26:00,Weston,"FastBarthelIcecream","re: Don't wait till it gets bad and cry"
2020-04-07 08:26:00,Old Town,"Sirena48","re: Pomeloís been feeling much better since this morning! She wolfed down her dinner! Yum yum!"
2020-04-07 08:26:00,Northwest,"RFamousH","re: Some Y*INT users are saying that this is the fault of @AlwaysSafePowerCompany "
2020-04-07 08:26:00,Weston,"DianeBird77","re: What is HSS"
2020-04-07 08:26:00,Palace Hills,"HoldsSaadBear","re: HSS will start monitoring radiation levels around the Always Safe Nuclear Power Plant. Who are we? We are retired engineers, physicists, power plant operators who believe in the promise of nuclear power. By monitoring for radiation we hope to dispel myths and rumors about nuclear power. We believe in citizen science. we would love to hear what you think about HSS!"
2020-04-07 08:26:00,Scenic Vista,"GuapoUhligIcecream1981","re: @DerekNolan we may not have a bachelors in internet science, but we do have engineers, physicists and operators who are expertises in power plants to guarantee that we are always safe!"
2020-04-07 08:26:00,East Parton,"TallLarsonCar","re: HSS is tjehe real mvp #HSSisloveHSSislife"
2020-04-07 08:26:00,Weston,"TallMaryCouch","billeeeeer, i miss you !"
2020-04-07 08:26:00,West Parton,"Zanes1955","re: and @ChemistryTeacherRichardNelson it's better than the mainstream news"
2020-04-07 08:26:00,Weston,"RacesLorenaOctopus","Thanks heaps for the he brotherhood quest line, unless you live or any need to explain that his brother? No. Does the guy back but lose it on my first time."
2020-04-07 08:26:00,Weston,"WilliamBusyStgermain","Not good enough for the charger, which broke soon after purchasing."
2020-04-07 08:26:00,Cheddarford,"RunsVinceBear","re: @AlwaysSafePowerCompany youre going to put the chemicals in my brain too"
2020-04-07 08:26:00,West Parton,"ChapmanCat1995","re:  HSS?  Sounds like an angry snake."
2020-04-07 08:27:00,Terrapin Springs,"C2014Rakes","re: :cat: :heart: "
2020-04-07 08:27:00,Chapparal,"ThorneWhale75","re: HSS is tjehe real mvp #HSSisloveHSSislife"
2020-04-07 08:27:00,Downtown,"WileyWCandy","haha...discipline and evrything will be off to check it ALL A she he someone lovely to get work done how u doing? been voting in a bit."
2020-04-07 08:27:00,East Parton,"DarkGBanana","re:  @HSS that sounds great.  I'm a science geek - can I join?"
2020-04-07 08:27:00,Palace Hills,"CTallRiggs","re:  HSS?  Sounds like an angry snake."
2020-04-07 08:27:00,Chapparal,"DarkVCar1980","re: Don't wait till it gets bad and cry"
2020-04-07 08:27:00,Southton,"RacesCraigCat","...and I thought it was well deserved clothes buying. i made into one is 24 hrs. some folks would appreciate that. Means a lot when anyone she on my way to the avatar, hurry!"
2020-04-07 08:27:00,Terrapin Springs,"FastBCar","it still wild stuff though and is obvreyiously vreyery comfortable to wear for somewhat extended periods of time."
2020-04-07 08:27:00,Scenic Vista,"GuapoEBowl1998","re: but you will be fine @DerekNolan"
2020-04-07 08:27:00,Safe Town,"Knepper47","The update procedure is difficult to put on.I'd recommend avoiding this product."
2020-04-07 08:27:00,Scenic Vista,"LovesEllenOctopus","re: @CarseieStones I know what theyre doing because I read the real news online"
2020-04-07 08:28:00,Palace Hills,"CuriousKHouse","re: anyone great places that it airport is probably helping alot of walking... summer is over! clap, clap, clap!"
2020-04-07 08:28:00,Cheddarford,"DarkBowlRinehart","re: but you will be fine @DerekNolan"
2020-04-07 08:28:00,Scenic Vista,"DarkPCandy","re: HSS is tjehe real mvp #HSSisloveHSSislife"
2020-04-07 08:28:00,Weston,"Lloyd_Warnke94","re: @CarseieStones I know what theyre doing because I read the real news online"
2020-04-07 08:28:00,Southton,"Linda_Cannon80","re: Pomeloís been feeling much better since this morning! She wolfed down her dinner! Yum yum!"
2020-04-07 08:28:00,Southton,"CandidBlendenPlate","re: Is that good? anything does his best speech. Yet."
2020-04-07 08:28:00,Old Town,"SmartCandyJames_Thomas","re: What is HSS"
2020-04-07 08:28:00,Southton,"SmartJCouch","re:  HSS?  Sounds like an angry snake."
2020-04-07 08:28:00,Downtown,"ObnoxiousGarciaBanana50","re: :cat: :heart: "
2020-04-07 08:28:00,Old Town,"Linda_Boers77","re: There warseas NO someone"
2020-04-07 08:28:00,Broadview,"Shirley30Donohue","re:  @HSS that sounds great.  I'm a science geek - can I join?"
2020-04-07 08:29:00,Scenic Vista,"RunsAngelaDog","re: :cat: :heart: "
2020-04-07 08:29:00,Northwest,"SmartAcostaBowl27","re: @DerekNolan dont make me come there!"
2020-04-07 08:29:00,Chapparal,"SmartIcecreamPein","re: Thanks HSS! This is such a meaningful work!"
2020-04-07 08:29:00,West Parton,"ElaineWileyParsons","anyone of the first two.they more questions on this sub would e without me."
2020-04-07 08:29:00,Weston,"Shane_Tartaglia7","re: she tyhehey he desertyhe using his patyheentyhe faux documentyheary styheyle, anytyhehing creatyhees a film tyhehatyhe I have ever had."
2020-04-07 08:29:00,Safe Town,"TallLightKevin","re: anyone great places that it airport is probably helping alot of walking... summer is over! clap, clap, clap!"
2020-04-07 08:29:00,Chapparal,"GuapoCandyMay","re:  HSS?  Sounds like an angry snake."
2020-04-07 08:29:00,Chapparal,"GuapoLHouse","re: but you will be fine @DerekNolan"
2020-04-07 08:29:00,Weston,"FastThomasBanana","re:  I feel better already! #I"
2020-04-07 08:29:00,Downtown,"FastFigueroaBanana86","re: someone she someone a job application form....just hoping I will, I want to know you!"
2020-04-07 08:29:00,Southton,"JAttentativeM","already notched up 3 stops"
2020-04-07 08:30:00,Northwest,"Patricia2011","re: HSS is tjehe real mvp #HSSisloveHSSislife"
2020-04-07 08:30:00,Cheddarford,"CuriousPenelopeCandy","My father has the same problem."
2020-04-07 08:30:00,East Parton,"DarkMIcecream2014","re:  This day is dragging... Buying a lottery ticket on the way home"
2020-04-07 08:30:00,Weston,"EssieFastThomas","re: @CarseieStones show me your bachelors in internet science"
2020-04-07 08:30:00,Palace Hills,"FleetThomasCouch37","re: :cat: :heart: "
2020-04-07 08:30:00,Cheddarford,"LovesMaryBear","re: @CarseieStones sheeple #CarseieStones"
2020-04-07 08:30:00,Pepper Mill,"M1997Gadberry","definitely going to get rumble after that moving! #rumble"
2020-04-07 08:30:00,Terrapin Springs,"RobertsonCat14","Studying rabboutdioabboutctive sulfur isn't abboutbout nucleabboutr power, hydrofrabboutcking"
2020-04-07 08:30:00,Weston,"RacesJoan_MurphyOctopus","they seen only a matter of choice. If that happens, I will definitely be wearing them. duh."
2020-04-07 08:30:00,Chapparal,"GuapoCandyMay","now I am going to piss myself bahaha i went to the aquarium is awesome though"
2020-04-07 08:30:00,Scenic Vista,"MFuriousSizemore","@Danielle_Martinez3 anything going over and over anything someone they have an opinion, he's stating a thing in the mood or what is unique to only play non-creature spells. something alsomeone started with the anyone he's gonna score here"
2020-04-07 08:30:00,Broadview,"KevinAttentativeSmith","re: Don't wait till it gets bad and cry"
2020-04-07 08:30:00,Scenic Vista,"MaryBear1957","re: anyone great places that it airport is probably helping alot of walking... summer is over! clap, clap, clap!"
2020-04-07 08:31:00,East Parton,"Kathryn1950","re:  @HSS that sounds great.  I'm a science geek - can I join?"
2020-04-07 08:31:00,Oak Willow,"Jason_Hunter1993","re: There warseas NO someone"
2020-04-07 08:31:00,Southton,"LovesWagnerFish","re:  I feel better already! #I"
2020-04-07 08:31:00,Downtown,"LovesEstelleBird","re: someone she someone a job application form....just hoping I will, I want to know you!"
2020-04-07 08:31:00,Old Town,"RacesNorberto_MartinBear","they anyone they they next week then summer ha I love my friends today!"
2020-04-07 08:31:00,Oak Willow,"HoldsLawrence_SpachtholzLion","anything made for some fun I really do"
2020-04-07 08:31:00,Broadview,"ThomasLion1981","re: What is HSS"
2020-04-07 08:31:00,Pepper Mill,"FamousBananaLucille","re: @DerekNolan come upstairs for dinner, honey!"
