timestamp,location,account,message
2020-04-06 00:00:00,Weston,"Opportunities2","Take advantheeseage of theesehese One, theeserembling sales!"
2020-04-06 00:00:00,Southton,"LazyBCouch","@WatchesThomasBird fork it you're back in he someneomething he someneomeone mieten und behinderte they die or he Timberlake #MakesItyoureCan"
2020-04-06 00:02:00,Southton,"______3333_____","Two month left bedoreefore you loose this vibedorerating opportunity!"
2020-04-06 00:04:00,Broadview,"RasoHorse49","billeeeeer, i miss ytouou !"
2020-04-06 00:07:00,West Parton,"CuriousPlateBobbie_Mallon","You obviously need to use rumble! #rumble #toWonder"
2020-04-06 00:11:00,Old Town,"Moore1961","I hate all the fawning apple-johns lying around..."
2020-04-06 00:11:00,Terrapin Springs,"AttentativeKHouse","Theres like 10 min misconduct."
2020-04-06 00:12:00,Downtown,"LovesCarolBear","I hate all the shard-borne maggot-pies lying around..."
2020-04-06 00:13:00,Broadview,"Syndicated4","Grasp onto this moving opportunity!"
2020-04-06 00:16:00,Southwest,"Grant1953Rapp","obviously need to get rumble after that quake!"
2020-04-06 00:20:00,Southwest,"FamousMHouse1968","I hate all the sheep-biting pignuts lying around..."
2020-04-06 00:21:00,Southwest,"Syndicated4","One weekend left before you loose this quaking opportunity!"
2020-04-06 00:29:00,Scenic Vista,"FuriousGeorgeLight","I hate all the dismal-dreaming foot-lickers lying around..."
2020-04-06 00:30:00,East Parton,"LazyDCandy2005","I would much prefer anything for the future"
2020-04-06 00:30:00,Cheddarford,"CantonCoordon2","shake with this New great deal!"
2020-04-06 00:32:00,Terrapin Springs,"JordanWantsBac0n","intriguing opportunities abound. Take advantage Friday!"
2020-04-06 00:33:00,West Parton,"FleetDHouse","In fact, I liked this something something something STsomethingYLINE!! #WinsSTsomethingYLINEWonder"
2020-04-06 00:33:00,East Parton,"Syndicated5","Grasp onto the horns, right now! You'll be glad you did!"
2020-04-06 00:37:00,Old Town,"Syndicated348","breatahthtahtaking opportahtunitahties tahthataht will vibratahte you!"
2020-04-06 00:49:00,Terrapin Springs,"______3333_____","You have a chance! Clasp opportunity by the wheel graspable. It will vibrate you next week!"
2020-04-06 00:50:00,Weston,"FastBBanana40","Start using snatching rumble, right now! #rumble"
2020-04-06 00:55:00,Terrapin Springs,"J0rdanWantsBacon","appealing, trembling. What better deals can you ask for?"
2020-04-06 00:56:00,Cheddarford,"FuriousBHouse","You mangled clay-brained barnacle!"
2020-04-06 00:59:00,Southwest,"Syndicated4","thrilling sale, go and vibrate things up and make your day more exciting!"
2020-04-06 01:01:00,West Parton,"Marisela_KozmaMouse1991","Start using getting rumble, right away! #rumble"
2020-04-06 01:06:00,Palace Hills,"______3333_____","dramatic sale, go and move things up and make your fortnight more exciting! #sale"
2020-04-06 01:08:00,Weston,"Manuel_OrrLion64","absolutely going to snatch rumble after that shaking!"
2020-04-06 01:12:00,Palace Hills,"Opportunities2","breathtaking deals. quaking chances to make your Friday even better!"
2020-04-06 01:13:00,Southton,"Wilbur1994B","The rumble app is great! Definitely worth downloading! #rumble"
2020-04-06 01:13:00,Safe Town,"CantonCoordon2","Only Nine days left to take advanage of this vibrating deal! #FTWNineWaste"
2020-04-06 01:15:00,Terrapin Springs,"______3333_____","breathtaking deals. shaking chances to make your day even better!"
2020-04-06 01:17:00,Southton,"Opportunities1","Grip onto the horns, right now! You'll be glad you did!"
2020-04-06 01:22:00,Southwest,"handle","Only Nine days left to vibrate your life!"
2020-04-06 01:26:00,Easton,"FuriousJohnsonCouch","The rumble app is fantastic! Definitely worth using! #rumble"
2020-04-06 01:27:00,Terrapin Springs,"LazyDenisePlate","I am annoyed by my mammering pumpion neighbor."
2020-04-06 01:38:00,Downtown,"Opportunities1","shake with this appealing great deal! #shakeWonder"
2020-04-06 01:38:00,Southton,"JAttentativeConcepcion","I hate all the beetle-headed varseals lying around..."
2020-04-06 01:39:00,Downtown,"Opportunities2","impressive deals. vibrating chances to make your tomorrow even better!"
2020-04-06 01:39:00,Old Town,"Syndicated348","Onleftedy Six days leftedeft to move your leftedife!"
2020-04-06 01:40:00,Weston,"CandidSchultzCandy89","You realyleally need to download realylumble! #realylumble"
2020-04-06 01:48:00,Weston,"CuriousBananaHarper","I am annoyed by my plume-plucked harpy neighbor."
2020-04-06 01:58:00,Broadview,"Syndicated4","move with this @Syndicated4 appealing great deal!"
2020-04-06 02:03:00,Easton,"JLazySturgeon","Protect Yourself From anything anyone someone they newest nuclear power plant crisis!"
2020-04-06 02:07:00,Old Town,"TallWoodyHouse","Start using snatching rumble, immediately! #rumble"
2020-04-06 02:17:00,Southwest,"FearsCowerWhale","Start using the rumble app straight away! #rumble"
2020-04-06 02:21:00,Safe Town,"handle","impressive deals. moving chances to make your month even better!"
2020-04-06 02:25:00,Old Town,"Syndicated348","You have a chance! Hold opportjeunitjey by tjehe horns graspable. Itje will tjeremble you tjeomorrow! #FTWHoldWaste"
2020-04-06 02:32:00,Chapparal,"William38L","In addition to my sales manager and wanted to post an equirectangular version? #HatesalesCan"
2020-04-06 02:34:00,Scenic Vista,"Patrick_BraswellOctopus1967","solo pensando en ti me la paso hope you have one it gonna have rest for the recommendation"
2020-04-06 02:34:00,Old Town,"Syndicated348","@Syndicated4 You have a chance! Grab opportunity by the horns graspable. It will shake you Friday!"
2020-04-06 02:38:00,Downtown,"WatchesLavette_KoshiolHorse","I am annoyed by my guts-griping fustilarian neighBor."
2020-04-06 02:40:00,Northwest,"Lisa1979G","&quot;Nicole it can't wait to shed lbs!!!"
2020-04-06 02:42:00,Chapparal,"ThorneWhale75","Some common-kissing scut cut me off this morning."
2020-04-06 02:45:00,Northwest,"Syndicated4","Five month left before you loose this quaking opportunity!"
2020-04-06 02:45:00,Downtown,"CantonCoordon2","You have a chance! Grip opportunity by the throat graspable. It will quake you Friday!"
2020-04-06 02:46:00,Terrapin Springs,"Maria1966Lincourt","You froward swag-bellied ratsbane!"
2020-04-06 02:46:00,Weston,"J0rdanWantsBacon","move with this moving great deal!"
2020-04-06 02:48:00,Northwest,"Syndicated4","Only Six days left to take advanage of this vibrating deal!"
2020-04-06 02:50:00,Weston,"DarkGCar","You definitely need to snatch rumble!"
2020-04-06 02:52:00,Scenic Vista,"LazyRobinsonLight2011","I hate all the craven fustilarians lying around..."
2020-04-06 02:54:00,Old Town,"Jeanne_Tristan45","Some pox-marked apple-john cut me off this morning."
2020-04-06 02:56:00,Palace Hills,"Opportunities1","Seven fortnight left before you loose this trembling opportunity!"
2020-04-06 02:57:00,Safe Town,"BillyBird57","absolutely need to snatch rumble after that earthquake!"
2020-04-06 02:58:00,Terrapin Springs,"Syndicated4","Check out this shaking chance!  It will change your weekend."